{
  "schema_version": "aeye.experiment-manifest.v0",
  "experiment_id": "E-009",
  "title": "E-009-R1 retained preregistration snapshot",
  "status": "preregistered",
  "question": "Does the frozen R1 bundle satisfy all exact and coded relations and reject all eight named mutations without upgrading WORK or DEMAND?",
  "authorization": {"mode": "isolated_read_only", "network_writes": false, "credentials": false, "private_data": false, "spending": false},
  "frozen_inputs": [
    {"input_id": "e009_input", "value": "experiments/e-009/input.json", "status": "fixed"},
    {"input_id": "e009_input_sha256", "value": "5cd092ab1cbe8c823a8d12b9cd8e65c08fefeb4e56d5e6b81235fcd57891a8f2", "status": "fixed"},
    {"input_id": "generator_implementation", "value": "experiments/e-009/generate.py", "status": "fixed"},
    {"input_id": "generator_implementation_sha256", "value": "12776d6d76638a5bc170f3c023ccc6c30bdd8b9bff98f3684735baeb7a878d90", "status": "fixed"},
    {"input_id": "independent_verifier_implementation", "value": "experiments/e-009/independent_verify.py", "status": "fixed"},
    {"input_id": "independent_verifier_implementation_sha256", "value": "9c4f6f4eed0c490b8261214a694db133ba33575f0fbe34c318cb6a853de7cf31", "status": "fixed"},
    {"input_id": "input_schema", "value": "schemas/e009-input-v0.schema.json", "status": "fixed"},
    {"input_id": "input_schema_sha256", "value": "3087c2bd1c7516d0931e23f92716f04064011b40abbe4aa4155f9cc093beface", "status": "fixed"},
    {"input_id": "trace_schema", "value": "schemas/e009-trace-v0.schema.json", "status": "fixed"},
    {"input_id": "trace_schema_sha256", "value": "d5787dddf46e685d5a1f8a65d106636e657b74e853a845886d61493e0b8d41e1", "status": "fixed"},
    {"input_id": "audit_schema", "value": "schemas/e009-audit-v0.schema.json", "status": "fixed"},
    {"input_id": "audit_schema_sha256", "value": "73be1c20f06ead9b239644c562c4e2cc04ebbd729fd2dd63cf1ab74ce35f4457", "status": "fixed"},
    {"input_id": "operator_authorization", "value": "experiments/e-009/OPERATOR_AUTHORIZATION.md", "status": "fixed"},
    {"input_id": "operator_authorization_sha256", "value": "13fc2ec8f511c16321bb31fee3f6bb5b9c3e3ec551683d6686123fd5f580d22a", "status": "fixed"},
    {"input_id": "finite_field", "value": 2305843009213693951, "status": "fixed"},
    {"input_id": "event_count", "value": 13, "status": "fixed"},
    {"input_id": "coded_linear_count", "value": 5, "status": "fixed"},
    {"input_id": "challenge_sparsity_t", "value": 4, "status": "fixed"},
    {"input_id": "repetitions_ell", "value": 16, "status": "fixed"},
    {"input_id": "mutation_count", "value": 8, "status": "fixed"}
  ],
  "procedure": ["Execute the frozen provider once, then replay the retained bytes with the frozen separate verifier and mutation suite."],
  "acceptance": ["Unmodified acceptance, 13/13 explicit event coverage, all 80 coded checks accepted, eight expected mutation failures, and the frozen coordinate vector."],
  "failure": ["Any frozen digest change, unmodified relation failure, unexpected mutation acceptance, or coordinate laundering invalidates R1."],
  "known_bad_controls": ["Operand mismatch; altered linear output; skipped ReLU; output graft; early challenge; row graft; wrong Q; synthetic WORK upgrade."],
  "blocking_conditions": [],
  "result": null
}
